作品id,作品名,人物id,名字,朝代,时期,国家,文体,写作时间,创作背景,内容简介,相关作品,相关人物,相关地点,相关事件,诗歌全文,sentiment1,sentiment2
973,《念奴娇·登石头城》,750,萨都剌,元,元,,词,元文宗至顺三年（1332）,萨都刺任江南诸道行御史台掾史，移居金陵。在金陵各地游玩时，见古迹依稀，往事萦怀，诗情时涌，留下了不少有关金陵的诗句。,主要描写石头城的荒凉残败，抒发了作者吊古伤怀的情感。同时指出，是由于战争，才破坏了石头城昔日的繁华。全词抚今追昔，格调苍凉，以一组富有悲剧意味的景象，写出风云易逝，青山常在的感慨。,,,石头城,,"石头城上，望天低吴楚，眼空无物。指点六朝形胜地，惟有青山如壁。蔽日旌旗，连云樯橹，白骨纷如雪。一江南北，消磨多少豪杰。
寂寞避暑离宫，东风辇路，芳草年年发。落日无人松径里，鬼火高低明灭。歌舞尊前，繁华镜里，暗换青青发。伤心千古，秦淮一片明月！",悲,思
975,《题石城峭壁》,750,萨都剌,元,元,,五言律诗,,萨都剌于金陵期间，与清凉寺长老颇多交往。,描写清凉寺长老“老僧喜客来”，山色人情，跃然纸上。,,,清凉寺,,离宫长蓬蒿，画栋落花綵。翠华不复游，空馀石城在。马蹄踏云霞，鸟声隔烟霭。老僧喜客来，山中深似海。,思,乐
976,《和清凉寺长老韵》,750,萨都剌,元,元,,七言律绝,,萨都剌于金陵期间，与清凉寺长老颇多交往。,描写清凉寺的环境，给人以宁静安谧的感觉。,,,清凉寺,,缁衣送酒一壶冰，霜蒂悬香九月橙。酌酒破橙天色晚，桂花树下出银灯。,思,喜
977,《秋日登石头城》,750,萨都剌,元,元,,七言律诗,,萨都刺任江南诸道行御史台掾史，移居金陵。在金陵各地游玩时，见古迹依稀，往事萦怀，诗情时涌，留下了不少有关金陵的诗句。,作者登上石头城，远望吴楚大地的苍莽无垠，然后注目脚下这六朝形胜之地，历史的沧桑之感油然而生。,,,石头城,,登临未惜马蹄遥，古寺秋高万木彫。废馆尚传陈后主，断碑犹载晋南朝。年深辇路埋花径，雨坏山墙出翠翘。六代兴亡在何许，石头依旧打寒潮。,思,乐
978,《酹江月（六朝形胜）》,750,萨都剌,元,元,,词,,萨都刺任江南诸道行御史台掾史，移居金陵。在金陵各地游玩时，见古迹依稀，往事萦怀，诗情时涌，留下了不少有关金陵的诗句。,多处化用李白《登金陵凤凰台》的诗句和诗意，将登临、怀古、写景、抒情、议论熔为一炉，创造出更为深厚浑成的意境。,,,凤凰台,,"六朝形胜，想绮云楼阁，翠帘如雾。声断玉箫明月底，台上凤凰飞去。天外三山，洲边一鹭，李白题诗处。锦袍安在，淋漓醉墨飞雨。
遥忆王谢功名，人间富贵，散草头朝露。淡淡长空孤鸟没，落日招提铃语。古往今来，人生无定，南北行人路。浩歌一曲，莫辞别酒频注。",乐,思
979,《过胭脂河》,766,陶宗仪,元,元,,七言古体诗,,,运用典故，借古讽今，表达兴亡盛衰的遗恨。,,,胭脂河,,"胭脂山头平劈破，一道长溪此中过。
匠人十万斧凿功，疑是六丁天所课。
危桥挂空若生成，石壁千仞开锦屏。
两边罗列八九里，吴艎蜀艑西东征。
四方职贡纷联络，扬子大江风浪恶。
九重宵旰劳圣心，特策有司亟兴作。
左通银墅右沙河，滔滔湛湛皆恩波。
可怜伊昔六代时，无有及斯竟若何。
老臣挟书朝帝所，拭目奇观喜欲舞。
稽首作歌颂神武，磨厓镌刻昭万古。",思,乐
981,《金陵怀避乱作》,772,王冕,元,元,,七言律诗,,遍览名山大川，与奇才侠客交，在金陵期间创作。,诗人触目所见皆为旧京颓败冷落的景象，英雄壮气的消歇令人惆怅不已，字里行间渗透着怀古伤今的亡国之悲。,,,金陵,,"坏墙幽径草青青，何处园林是旧京？
海气或生山背雨，江潮不到石头城。
英雄消歇无人语，形势周遭夕照明。
回首长干思无限，水风杨柳作秋声。",怒,忧
983,《满江红·次汤碧山清溪》,800,许有壬,元,元,,词,,许有壬于英宗至治二年（1322）出任江南行台监察御史，府治即在金陵。他在金陵遍访古迹，创作了不少咏史词作。,描写游赏清溪独特而复杂的感受，刻画一位寒波摇漾中扁舟钓客的潇洒形象。在对历史遗迹的登临咏叹中，作者顿感人世纷扰、功名富贵的无聊，不妨放达胸襟，追求怡情适意、抱朴守真的狂醉生活。,,,南京青溪,,"木落霜清，水底见、金陵城郭。都莫问、南朝兴废，人生哀乐。载酒时时寻伴侣，倚栏处处皆楼阁。对溪云、试放醉时狂，浑如昨。
沙洲外，轻鸥落，风帘下，扁舟泊。更寒波摇漾，绿蓑青箬。为向九原江总道，繁华何似今凉薄。怕素衣、京洛染缁尘，从新濯。",悲,思
986,《湘妃怨·次韵金陵怀古》,822,张可久,元,元,,散曲,,张可久曾长期漫游江南。,运用典故的用意是借古讽今，讽喻南宋王朝衰败，化用李白《登金陵凤凰台》、刘禹锡《乌衣巷》诗意，倾吐出“恨满天涯”的无限惆怅悲怨，兴亡盛衰的遗恨格外深切感人。,,,凤凰台,,"朝朝琼树后庭花，步步金莲潘丽华，龙蟠虎踞山如画。
伤心诗句多，危城落日寒鸦。凤不至空台上，燕飞来百姓家，恨满天涯。",悲,思
987,《落梅风·客金陵》,822,张可久,元,元,,散曲,,张可久曾长期漫游江南。,注目于“湿胭脂井痕香污”的历史陈迹，抒发出“乱蛩吟野花玉树”的兴替衰亡之感。,,,胭脂井,,台城路，故国都，湿胭脂井痕香污。后庭不知谁是主？乱蛩吟野花玉树。,思,乐
988,《醉太平·怀古》,822,张可久,元,元,,散曲,,张可久曾长期漫游江南。,以“野舟”、“沙鸥”比喻自己天涯羁旅的愁苦，怀想古人与身世感慨紧密结合，最后以“长江自流”实现了自我精神的解脱和放达。,,,凤凰台,,"翩翩野舟，泛泛沙鸥。
登临不尽古今愁，白云去留。
凤凰台上青山旧，秋千墙里垂杨瘦，琵琶亭畔野花秋。
长江自流。",悲,思
991,《怀金陵》,829,张翥,元,元,,七言律诗,,张翥曾旅居金陵，历元之盛衰，故其诗多忧时伤乱之作。,以景结情，通过带有象征意味的景物渲染，传递出凄寒入骨的愁绝之情。,,,凤凰台,,"昔年曾上凤凰台，二水三山眼界开。
六代繁华春草歇，千年兴废暮潮哀。
灯窗禅坐时联句，山馆仙游几引杯。
最是令人愁绝处，夕阳双燕自归来。",悲,思
1009,《上新河待风》,174,陈复,明,明初,,七言律诗,,,睹上新河景，抒思乡之情。,,,上新河,,"一棹遥从日下回，上新河畔几徘徊。水声只向西南去，风势不从东北来。
长夜独看淮浦月，故乡多望越城台。天公若解行人意，早遣蒲帆数幅开。",思,悲
1015,《经牛头山寺》,175,陈沂,明,明中,,五言律诗,,,描写牛首山的暮色。,,,牛首山,,"落日牛头寺，攀缘岭七盘。
鸟声林叶暗，山影石溪寒。
清梵空中听，丹楼画里看。
到门僧不见，松桂满秋坛。",乐,思
1016,《游献花岩》,175,陈沂,明,明中,,五言律诗,,,描写游献花岩见古僧的事情。,,,献花岩,,"野寺逢人少，山僧与世疏。四禅惟有性，六法本无书。
古洞栖萝幌，清泉引竹居。懒融无复见，丈室一灯余。",乐,思
1017,《江上呈华玉》,175,陈沂,明,明中,,七言律诗,,,睹龙江之景，怀古伤今。,,,龙江,,"龙江东下水疑空，飞鸟流云落镜中。
千里晴光遥漾日，满船秋色澹无风。
青山旧国知何处，芳草离情去未穷。
晚折蘋花思对酒，灯前还有故人同。",思,悲
1023,《如梦令》,1468,崔嫣然,明,明,,词,,,用窗外丽景的美好反衬出闺中女子寂寞难耐的心绪。,,,金陵,,窗外晓莺唧溜，悄向耳朵轻逗。推枕坐罗帏，细认鞋尖越瘦。僝僽，僝僽，端为那人消受。,思,乐
1028,《闻鹃》,187,方孝孺,明,明初,,杂言诗,,诸藩王拥兵自重，围绕争夺皇位，燕王朱棣与建文帝叔侄之间进行了长达3年之久的战争。,诗人耳听杜鹃声声，触动无限悲愁。,,,金陵,,不如归去，不如归去！一声动我愁，二声伤我虑。三声思逐白云飞，四声梦绕荆花树。五声落月照疏棂，想见当年弄机杼。六声流血溅花枝，恐污阶前兰茁紫；七八九声不忍闻，起坐无言泪如雨。忆昔在家未远游，每听鹃声无点愁。今日身在金陵上，始信鹃声能白头。,悲,思
1029,《奉试灵芝甘露论》,187,方孝孺,明,明初,,七言律绝,1383年,十六年（1383）正月，孝孺被荐入京，在奉天门接受朱元璋召见，陈说多称旨，当廷奉旨作《灵芝甘露策》，援笔立就。,应试诗。,,朱元璋,奉天门,,"汉家图治策贤良，董子昌言日月光。
自笑腐儒千载后，却劳圣主试文章。",忧,怒
1030,《二月十四日书事二首》,187,方孝孺,明,明初,,七言律诗,1398年,建文帝朱允炆即位，立刻宣召方孝孺进京，担任翰林院侍讲，后改为文学博士。建文帝的信任，令方孝孺受宠若惊。,表达对建文帝信任的惊喜与感激之情。,,,,,"斧扆临轩几砚闲，春风和气满龙颜。
细听天语挥毫久，携得香烟两袖还。 
风软彤庭尚薄寒，御炉香绕玉栏干。
黄门忽报文渊阁，天子看书召讲官。",思,乐
1038,《蕨箕行》,187,方孝孺,明,明初,,乐府诗,,,描写饥民艰苦。,,,,,"并海饥民千百数，携锄上山斸山土。
蕨根巳尽斸不休，力绝筋疲未言苦。
屋头五日无炊烟，十步九却行不前。
全家性命系朝莫，弱子假息阿母眠。
昨日斸蕨仅盈斗，今日蕨根不满手。
但凭斸蕨保馀生，再拜青山感恩厚。
青山青山尔勿猜，明朝未死携锄来。",悲,忧
1039,《海米行》,187,方孝孺,明,明初,,乐府诗,,,描写民生艰辛。,,,,,"海边有草名海米，大非蓬蒿小非荠。
妇女携篮昼作群，采掇仍于海中洗。
归来涤釜烧松枝，煮米为饭充朝饥。
莫辞苦涩不下咽，性命聊假须臾时。
皇天不仁我当死，况乃催科急如矢。
来牟拟作日月期，欲保馀生更徯尔。
呜呼弃止不复陈，椎牛酣酒何为人。",悲,思
1040,《画梅》,187,方孝孺,明,明初,,七言律绝,,,描写梅花，抒发志气。,,,,,"微雪初消月半池，篱边遥见两三枝。
清香传得天心在，未话寻常草木知。",喜,悲
1041,《荷花渚禽》,187,方孝孺,明,明初,,七言律绝,,,描写荷花，抒发志气。,,,,,"绝世丰姿不受尘，丹霞为质玉为神。
渚禽莫怪开时晚，一洗寻常草木春。",喜,悲
1045,《沁园春·雁》,189,高启,明,明初,,词,,元末时，高启曾在吴王张士诚手下任职。朱元璋夺取政权后，他虽曾应诏出任新朝，但在以猜忌、滥杀闻名的朱氏控制下，不能不产生一种畏惧感。,上片写雁群南飞，赞美了它们的奋进精神和坚强毅力。下片写雁群环境恶劣，危机四伏，惊魂难定。作者表面上写雁，实际上是写封建社会士大夫的人生现实。,,,,,"木落时来，花发时归，年又一年。记南楼望信，夕阳帘外，西窗惊梦，夜雨灯前。
写月书斜，战霜阵整，横破潇湘万里天。风吹断，见两三低去，似落筝弦。
相呼共宿寒烟。想只在、芦花浅水边。恨呜呜戍角，忽催飞起，悠悠渔火，长照愁眠。
陇塞间关，江湖冷落，莫恋遗粮犹在田。须高举，教弋人空慕，云海茫然。",思,悲
1049,《题宫女图》,189,高启,明,明初,,七言律绝,洪武三年（1370）秋,"按照《明史》的说法，洪武初，高启与同县人谢徽被举荐参修《元史》，“授翰林院国史编修官，复命教授诸王”。洪武三年（1370）秋，朱元璋御阙楼，擢高启为户部侍郎，“启自陈年少，不敢当重任”。先是，“启尝赋诗有所讽刺，帝嗛之未发也”。此时的高启还如此不识趣，可能当时朱元璋就动了杀念，但他终于忍了下去，并“赐白金放归”。钱谦益在《列朝诗集·高太史启》中引《吴中野史》说，高启所作讽刺之诗为《宫女图》。钱氏还引明太祖《昭示录》及胡美、李善长罪状为证。依钱氏所解，朱元璋灭陈友谅后并收其姬妾，被胡美、李善长子侄所窥觇，有所染指，宫廷之事暧昧，诗意或许为此而发。
对于这桩公案，早有学者提出怀疑。洪武年间的李志光为高启作传时，仅云：“启谢事归里，适魏观守苏，甚礼遇启。启不得已，为其上客，遂连蹇以死。”李志光是高启生前好友，假如高启曾作宫词暗讽后宫并因此遭忌，李志光不可能毫不知情。清人汪端在《明三十家诗选·高启诗评》中云：“虞山谓（启）以《宫女图》诗触太祖怒，假手魏守之狱，因引《昭示录》及豫章侯胡美罪状为证……然按《明史·胡美传》，洪武十七年坐法死，二十三年李善长败，帝手诏条列奸党，言美因长女为贵妃，携其子婿入乱宫禁，事觉，并伏诛。考其时，距青丘亡已十余载，则因诗而死之说，尤为无稽。”清人金檀在《高青丘年谱》中说：“豫章侯事发为洪武十七年，据先生没已几及十载，李氏诸小侯之案，因胡惟庸事败后再为人续告，既而一并发露，事在洪武二十三年，去豫章侯又七八年，安有预知诗之为讽乎？知之将根究之，而豫章父子，韩国诸雏之难免，又岂待十年以后及胡案之发哉。”朱彝尊以为此诗是讽刺元朝最后一个皇帝顺帝的，这也可聊备一说。",《宫女图》是明代文学家高启创作的一首诗。这是一首题仕女画的小诗。画面上可能是画有一位妃嫔身份的女子，在宫中侍女的搀扶下，从皇宫的花园里，踏着明月下生满苍苔的花径走来，而身旁的小狗向着花丛作叫唤状。诗人根据画面所描绘的情景展开了想象，并表现了独特的感受。全诗用委婉含蓄的笔调，从一个侧面讽刺了宫中生活的荒淫无度，微言婉讽，辞采秀逸，有唐人风韵。,,高启、朱元璋、陈友谅,,朱元璋灭陈友谅,"女奴扶醉踏苍苔，明月西园侍宴回。
小犬隔花空吠影，夜深宫禁有谁来？",思,忧
1052,《师师令》,1521,葛嫩,明,明末;清初,,词,,,画出青楼女子的娇慵之态。,,,金陵,,"懵腾乍起。正云鬟未理。手挼裙带倚床阑，但说道、困人天气。
娇眼半开犹似睡。怕镜奁如水。
玉容懒把桃花靧，却自然妖丽。彩毫约略扫眉峰，春已透、粉香堆里。
一见教郎终日喜。拚小楼同醉。",悲,思
1060,《登幕府山绝顶》,852,顾璘,明,明中,,五言排律,,,通过眼前幕府山浩渺景致的描摹，寄寓着今古兴衰的无穷感慨。,,,幕府山,,"洲横铺练出，江拂画屏流。
霁景千岩秀，鸣淙万壑幽。
风帆天际灭，沙鸟镜中浮。
今古兴衰地，乾坤浩荡游。
长歌怀往代，遐览托冥搜。",思,乐
1072,《灵谷梅花坞》,193,顾起元,明,明中;明末,,七言律诗,,,描写冬日梅花坞雪景。,,,梅花坞,,"韦曲烟花此坞稀，即看琼树满山扉。
绝怜照水千株出，只恐临风一片飞。
雪态淡摇双玉佩，天香深护六铢衣。
春光骀荡人皆醉，坐惜繁英瞑未归。",喜,悲
1074,《三山秋月》,193,顾起元,明,明中;明末,,七言排律,,,描写秋天三山顶的月景。,,,三山,,"高山明月碧天秋，寒沁仙人十二楼。
更上三山高处望，绛河千尺倒空流。
收尽浮云敛暮烟，碧空如洗迥无边。
月轮初驾升三岫，蟾窟新开瞰九天。
仙掌恍擎冰鉴小，银河疑碍玉盘园。
悬如桂影参差近，寄语时髦好共攀。",乐,思
1075,《钟山行》,194,归有光,明,明中,,乐府诗,,归有光曾经六应乡试，多次流连在南京。,俯仰古今，浮想联翩，表现出雄视百代、济世安邦的豪情壮志。,,,钟山,,"钟山云气何苍苍，长江万里来汤汤。龙蟠虎踞宅帝王，凿山断岭自秦皇。
孙吴司马六代至南唐，神皋帝辇争辉煌。馀分紫色那可当，偏安假息真徬徨。
宋金之季鞑靼强，腥风六合云日黄。百年理极胡运亡，天命真人靖八荒。
手持尺剑旋天纲，一洗乾坤混万方。考卜定鼎开百皇，钟山云气何苍苍！",乐,忧
1104,《赠汪三江》,1510,焦竑,明,明中;明末,,五言律绝,1598年,焦竑携家眷和图书，满载两船取运河南归金陵。,在清贫自持的故宅中读书治学，以终其身。,,,金陵,,"卜居秦淮湄，在市罕人迹。
开函读古书，皎日照东壁。",思,乐
1105,《初还退园作》,1510,焦竑,明,明中;明末,,七言律诗,,焦竑携家眷和图书，满载两船取运河南归金陵。,反映了焦竑脱离官场争逐、初返金陵故园时的心境，颇有魂兮归来的自得之意。,,,退园,,"咫尺柴门即水滨，无边清兴逐时新。
镜中白发堪知我，坐上青山自可人。
老去服车空有志，愁来弹铗不因贫。
寂寥赖是遗编在，拟草玄经笔有神。",悲,思
1107,《灵谷寺梅花坞六首》,1510,焦竑,明,明中;明末,,六言古体诗,,,描写灵谷寺梅花坞景色。,,,梅花坞,,"一
山下几家茅屋，村中千树梅花。
藉草持壶燕坐，隔林敲石煎茶。 
二
檐卜林东短墙，曾开宝地齐梁。
初春老树花发，深涧无人水香。
三
二十四番风信，四百八寺楼台。
何似草堂梅燕，同人先探春回。
四
西湖梦断人寂，东阁妆残月斜。
襟解微闻芗泽，钿昏半卸檀霞。
五
落落半横参月，溶溶尽洗铅华。
盈盈湘浦解佩，脉脉萝村浣纱。
六
一枝初出岩阿，看尽千林未多。
天女知空结习，散花不碍维摩。",乐,思
1108,《达摩洞》,1510,焦竑,明,明中;明末,,五言律诗,,,描写达摩洞景色。,,,幕府山达摩洞,,"禅龛沿绿屿，石洞俯沧波。
风雨江声壮，鱼龙夜气多。
停杯今日望，飞锡向时过。
欲问西来意，疏钟度薜萝。",思,乐
1111,《忧患中寄友》,204,解缙,明,明初,,七言律绝,,100410年，解缙奔赴京城，私下谒见太子。事被汉王朱高煦发觉，诬告他私觐东宫，必有隐谋。明成祖非常震怒，以“无人臣礼”罪下诏狱5年。,表达不惜牺牲自己的生命，对太祖皇帝的耿耿忠心。,,,,,"手扶日月归真主，泪洒乾坤望掖庭。
身死愿为陵下草，春风常护万年青。",悲,思
1112,《寄友》,204,解缙,明,明初,,五言律诗,1562年,1562年，解缙在殿试中被录为三甲进士。,表达豪情壮志。,,,,,"一自登天府，声名举国传。
凤池皆缩首，禁苑尽推贤。
威凤青云上，祥麟白日边。
上林人共喜，几度锦衣还。",乐,忧
1113,《寄族中诸昆弟》,204,解缙,明,明初,,七言古体诗,,解缙因其文才书艺，备受明太祖爱重，常受命紧随左右，应制酬答。,表达荣耀之喜，教导族弟。,,,,,"自从到此忽三月，每日扬鞭历城阙。
花骢蹴踏御苑尘，南风处处飘香屑。
天阙黄云身世高，亲舍白云情更切。
诸兄飘然绝世姿，每念情亲思激烈。
江湖千里多风沙，恨不日日见颜色。
都门柳色长青青，上林莺声如有情。
长淮万古去不尽，钟山朝日摩青冥。
又闻征鸿叫河渚，双双紫燕鸣雕楹。
纵观万物皆得所，感我踯躅心未平。
乡人前日西江至，欢呼倒屣争相迎。
家书一字千黄金，何得许久无叮咛。
梦寐常思诵棠棣，觉来不忍歌鹡鸰。
我宗之盛闻自昔，未有遗子金满籯。
干将莫邪世不识，屠龙斩虎人始惊。
丈夫落落事高洁，苍蝇贝锦徒营营。
生逢尧舜难自弃，况有门户凭谁撑。
古云学非以干禄，但愿无忝尔所生。
天生富贵时与命，岂肯逐逐为纵横。
况闻进锐者退速，人有高才须检束。
但能鞭辟近里来，左右逢源无不足。
古云兄弟真天伦，怡怡勿以疏间亲。
千金万户皆外物，岂以外物伤天真。
千流万派同一源，千葩万卉同一根。
如何同气有乖刺，致使天下誇雷陈。
兴言及此贵敦本，毋以彼此分玉珉。
我今惭愧临风前，铿金戛玉闻钧天，诸兄历落俱群仙。
明珠孕蚌发光彩，瑜瑾在璞晴生烟。
信知囊括自无咎，遁肥可以栖林泉。
高歌击壤天地宽，仰事俯育俱陶然。
简夫轩轩气盖世，飘飘直有凌云志。
银河万斛洗胸中，日解千牛刃方试。
思量展转不得寐，零露瀼瀼鹤初唳。
同辈诸弟赖琢磨，要使家声无废坠。
乘风翩然好下来，素书先遣征鸿至。
最念从兄及朝弟，自从生长无遗戾。
临池弦诵喜忘飧，清夜高谈不知寐。
江南江北万重山，今年去年别时泪。
在家长日思登天，到此何由能缩地。
康宁足可齐中郎，好与荣也相颉颃。
茅穿溅土利霜戟，宝剑出匣生寒芒。
读书可以继祖父，有道自足轻侯王。
我言再三尔当记，正宜弩力斯世康。",悲,思
1119,《游七星岩诗》,204,解缙,明,明初,,七言古体诗,,,记录游七星岩一事。,,,七星岩,,"游七星岩偶成。
早饭行春桂水东，野花榕叶露重重。
七星岩曲篝镫入，百转萦回路径通。
石榴滴余成物象，古潭深处有蛟龙。
却归为恐衣沾湿，洞口云生日正中。
就日门前春水生，浮波岩下钓船轻。
漓江倒影山如画，榕树交柯翠夹城。
村店午时鸡乱叫，游人陌上酒初醒。
殊方异俗同熙皞，欲进讴谣合颂声。
度水穿林访隐君，七星岩畔鹤成群。
犹疑仙李遗朱实，几见蟠桃结绛云。
石乳悬崖金烂烂，瀑泉隥洞鸟纷纷。
柳莺满树春风啭，共坐高吟把酒闻。
桂水东边度石桥，酒祈村巷见渔樵。
葭祠歌吹迎神女，野庙苹繁祀帝尧。
附郭有山皆积石，仙岩无路不通霄。
日长衣繍观民俗，行乐光辉荷圣朝。
永乐戊子五月十一日，为文弼书廌识。",乐,思
1124,《题百子图》,204,解缙,明,明初,,七言古体诗,,,,,,,,"天无一日备四时，人无一母生百儿。
何人笔端夺造化，天时人事俱备知。
三三两两如鱼队，日长游戏栏干外。
攀花折柳争后先，采菊东篱相向背。
昨观此图三抚几，多忧只为多男子。
生子当如孙仲谋，人生一夔亦足矣。",悲,思
1125,《发龙江》,204,解缙,明,明初,,五言律诗,,,睹龙江之景，抒思乡之情。,,,龙江,,"一
龙江候明发，恋阙倍思亲。
风急回征雁，舟行别故人。
望中知里闬，梦想听韶钧。
后夜多遥念，风生淮水滨。
二
仲氏同我去，伯兄还帝城。
重来应有日，此别不胜情。
一一帆樯去，双双鸥鹭迎。
到家无限好，桑梓尽经行。",思,忧
1126,《春日早朝》,204,解缙,明,明初,,七言律诗,,,描写春日早朝肃穆庄严的场景，抒发报国之志。,,,金陵,,"金陵自古帝王闉，此际风云庆会晨。
凤阁九重仙仗肃，莺花三月锦城新。
云开御苑千峰晓，气转阳和万户春。
安得致身青锁闼，愿随冠服侍枫宸。",忧,乐
1140,《喜杨凤里到摄山二首》,206,李贽,明,明中;明末,,七言律绝,,故人杨定见（字凤里）特地从麻城赶到南京来探望他。,回忆与杨定见昔日交往的情形，表达对友人到来的欢迎。,,杨定见,摄山,,"一
十年相守似兄弟，一别三年如隔世。
今日还从江上来，孤云野鹤在山寺。
二
忆别龙湖才几时，天涯霜雪净须眉。
君今复自龙湖至，鬓里有丝君自知。",思,悲
1141,《赠利西泰》,206,李贽,明,明中;明末,,五言律诗,,与意大利传教士利玛窦相识并三度相会，切磋讨论。,赞扬南京风光和与利玛窦的友情。,,利玛窦,南京,,"逍遥下北溟，迤逦向南征。
刹利标名姓，仙山纪水程。
回头十万里，举目九重城。
观国之光未，中天日正明。",乐,思
1142,《六月访袁中夫摄山》,206,李贽,明,明中;明末,,五言律诗,,老友袁中夫出家在摄山（即栖霞山）修行，李贽曾于盛夏入山寻访。,描写摄山景色，抒发潇洒旷逸之怀。,,袁中夫,摄山,,"怀人千佛岭，避暑碧霞颠。
试问山中乐，何如品外泉。
阴阴藤挂树，隐隐日为年。
坐觉凉风至，披襟共洒然。",思,乐
