作品id,作品名,人物id,名字,朝代,时期,国家,文体,写作时间,创作背景,内容简介,相关作品,相关人物,相关地点,相关事件,诗歌全文,sentiment1,sentiment2
402,《采莲曲》,94,萧纲,南朝,梁,,乐府诗,,萧纲此诗则袭用旧题，用清丽浅显的语言，描绘诗人泛舟湖上采摘莲蓬的图景，表现了他悠然闲适的情趣。,《采莲曲》写出了江南美丽风光，全诗情韵流动。,,,,,"【其一】
晚日照空矶，采莲承晚晖。
风起湖难度，莲多摘未稀。
棹动芙蓉落，船移白鹭飞。
荷丝傍绕腕，菱角远牵衣。
【其二】
常闻蕖可爱，采撷欲为裙。
叶滑不留綖，心忙无假薰。
千春谁与乐，唯有妾随君。",思,悲
452,《采菱曲》,123,徐勉,南朝,梁,,五言古体诗,,诗人仿民间的棹歌，在内容上的特点便是强化了棹女情郎式的爱情主题，从而细致描写了采菱女的相思心理。,,,,,,"相携及嘉月，采菱渡北渚。
微风吹棹歌，日暮相容与。
采采不能归，望望方延伫。
傥逢遗佩人，预以心相许。",思,忧
3361,《凤凰台》,713,梁栋,宋,宋,,七言律诗,,,,,,凤凰台,,白发久孤鹦鹉杯，碧梧自老凤凰台。管夷吾亦仅如许，李谪仙今安在哉。城郭是非秋雨外，江山形胜暮潮来。小留只等中秋月，且放青冥万里开。,思,乐
3882,《游女曲》,97,萧衍,南朝,梁,,乐府诗,,,,,,,,氛氲兰麝体芳滑。容色玉耀眉如月。珠佩婐女巵戏金阙。戏金阙。游紫庭。舞飞阁。歌长生。,乐,思
1731,《金陵杂咏》,0,査慎行,清,清初;清中,,七言律绝,,,,,,,,"其一
沙漠真人本至尊，青蛇罢祀出梧垣。
孝陵松柏犹樵牧，元庙何妨有泪痕。
其二
想像承平乐事留，履綦陈迹也风流。
轻烟翠柳今何处，十六门如十六楼。
其三
洒扫他时属内官，钟声好句逼人寒。
御沟尽有流红事，尘壁伤心是媚兰。
其四
夜半传呼聚宝门，金蟾啮锁内城昏。
武皇大有南迁意，故遣銮舆宿报恩。
其五
蒙溪石刻表南都，形势居然屹壮图。
白马青丝他日事，仓皇曾补一毫无。
其六
妙选三家入后宫，抱来马上石榴红。
胭脂不到长城外，何必明妃怨画工。
其七
武定桥栏玉磬如，泠泠七尺响清虚。
蜀桐不发岐阳扣，等是昆冈劫火馀。
其八
宗伯奁清世不知，菱花初照月临池。
点妆巾帽俱新样，不用喧传镜背诗。
其九
杏村玉树接春华，太史诗留典客家。
不许绣毬誇独绝，凤台还有紫微花。
其十
薜鸭袁羊匕箸馀，江鲜风味只如初。
年年八月随潮上，柳贯红腮燕子鱼。
其十一
粉竹香尘调不齐，和来雁字斗高低。
即从红豆徵奇丽，便压元人十四题。
其十二
顿老琵琶擅教坊，供筵法曲别歌章。
故须小技通文义，垂老知音付漫郎。
其十三
雷雨随弦四座惊，秀之绝调自泠泠。
隔帘传语催停板，头白扶来制泪听。
其十四
昭文小楷法黄庭，绣佛新诗玉琢成。
不及锦云名句好，断肠芳草断肠莺。
其十五
一月花名簇锦筵，旧家手帕亦因缘。
曾陪盒子春檠会，冷落飘灯四十年。
其十六
鳌足盘龙气象吞，东华扶出尚惊魂。
书生小胆当前破，何取纷纷出大言。
其十七
后村傲兀自奇才，觅句曾过此地来。
春草不生山路白，树阴浓罩雨花台。
其十八
卧游宗炳已伤神，画社秦淮点染新。
怪得江山生色少，少冈老死更无人。
其十九
钞库街头第一坊，游人消渴试新尝。
近来曲巷添茶社，谁记新都是滥觞。
其二十
名士年来已可嗔，骑驴腰扇怕逢人。
李昭竹骨王郎画，难掩西风障扇尘。",乐,思
3791,《金陵杂咏（选三首）》,455,王友亮,清,清,,诗,,,一、二怀古，三咏物。,,李白,落星墩、静海寺、姚坊门,,"其一：落星冈怀李白
骑鲸仙人钓鳌客，小驻金陵饮春色。鹭洲寂寞凤台荒，醉卧落星冈畔石。淋漓倒著宫锦袍，不独诗豪更酒豪。欲唤东风吹渌水，大江尽化为醇醪。山川佳丽仍如绘，我来望古遥相酹。双屐曾留藓字中，一旗尚曳禽言外。海东飞上白玉盘，无复醉影凌珊珊。光芒剩得诗千首，尚可高吟落星斗。
其二：静海寺
舣棹秋江十里长，招提结伴且寻将。凭谁寻路蹲狮子，怪尔开门叫凤凰。海外灵槎曾揽胜，岩端健笔自流芳。老僧不解观空旨，对客犹然说郑铛。
其三：姚坊门枣
新秋佳果说姚坊，火齐堆盘喜乍尝。甜到十分知过雨，艳生半颊为迎阳。戏抛恰可同心赤，饱掇何须患齿黄。记得吕家山畔路，薰风先递枣花香。",思,悲
790,《乌夜啼（林花谢了春红）》,710,李煜,南唐,南唐,,词,,这首词作于北宋太祖开宝八年（公元975年）李煜被俘之后。待罪被囚的生活使他感到极大的痛苦。他给金陵（今江苏南京）旧宫人的信说“此中日夕，只以眼泪洗面”。此词即写于作者身为阶下囚时期。,此词将人生失意的无限怅恨寄寓在对暮春残景的描绘中，是即景抒情的典范之作。,,,,,"林花谢了春红，太匆匆！
常恨朝来寒重晚来风！
胭脂泪，留人醉，几时重？
自是人生长恨水长东！",悲,思
794,《乌夜啼》,710,李煜,南唐,南唐,,词,,开宝八年（公元975年），李煜亡家败国，肉袒出降，被囚禁待罪于汴京。宋太祖赵匡胤因李煜曾守城相拒，封其为“违命侯”。李煜屈辱地过起了囚徒生活。本首词就是李煜降宋后生活实况和囚居心境。,全词比较鲜明地体现了李煜后期作品的特色：情感真实，清新自然。尤其是这首词，作者对自己的苦痛毫不掩饰，把自己的人生感慨明白写出，不假饰，不矫情，简洁质朴，有现实感。,,,,,"昨夜风兼雨，帘帏飒飒秋声。烛残漏断频欹枕，起坐不能平。　
世事漫随流水，算来一梦浮生。醉乡路稳宜频到，此外不堪行。",悲,思
739,《游栖霞寺》,819,张翚,唐,唐,,五言律诗,,,,,,,,跻险入幽林，翠微含竹殿。泉声无休歇，山色时隐见。潮来杂风雨，梅落成霜霰。一从方外游，顿觉尘心变。,乐,思
3510,《游栖霞寺》,742,皮日休,唐,唐,,五言律诗,,晚唐末世政治黑暗、仕途坎坷，诗人倾向隐逸。,描写栖霞寺的空寂，歌颂隐逸之意。,,,栖霞寺,,"不见明居士，空山但寂寥。
白莲吟次缺，青霭坐来销。
泉冷无三伏，松枯有六朝。
何时石上月，相对论逍遥。",思,乐
3899,《入朝曲》,115,谢朓,南朝,齐,,五言古体诗,,公元490年谢脁27岁，青年诗人对功名事业和前途充满了信心。这年八月，随王萧子隆为荆州刺史，谢脁迁镇西功曹并转文学。赴荆州途中，他奉随王教写下了《鼓吹曲》十首。这首《入朝曲》便是其中的一篇。,刻画了帝都金陵（今南京）的富丽繁华和心系功名的进取精神，既是一曲颂歌，也是一幅壮丽的图画。不管是何种情感意趣，都可以借山川景物来表现，而且达到情景交融的境界。造境宏伟高敞，措笔秀丽工整，语言清鲜流丽，反映出了青年谢朓积极进取的精神品格和非同寻常的艺术功力。首联总揽形势，虚笔入篇。中间三联承“帝王州”写来，具体描绘当今“帝王州”的形势。诗人特别注重视角的变化。沿巍峨帝都顺势望去，但见城墙环绕着蜿蜒曲折的护城河，绿波荡漾，风光旖旎；抬头远眺，又见层层高楼，鳞次栉比，在日光照耀之下，显得灿烂辉煌。这是二联，是写远眺。三联则取近观。最后一联收束全篇。古人旧例，功成名就，登台受赏。,《鼓吹曲》,萧子隆,荆州,谢朓赴荆州,"江南佳丽地，金陵帝王州。
逶迤带绿水，迢递起朱楼。
飞甍夹驰道，垂杨荫御沟。
凝笳翼高盖，叠鼓送华辀。
献纳云台表，功名良可收。",乐,怒
93,《桃叶歌（三首）》,83,王献之,东晋,东晋,,五言古体诗,,,,《古今乐录》,桃叶,,,"【其一】
桃叶映红花，无风自婀娜。
春花映何限，感郎独采我。
【其二】
桃叶复桃叶，桃树连桃根。
相怜两乐事，独使我殷勤。
【其三】
桃叶复桃叶，渡江不用楫。
但渡无所苦，我自迎接汝。",思,悲
3132,《桃叶歌》,351,顾炎武,明,明,,词,,,,《古今乐录》,,越州、桃叶渡、江南,,"桃叶歌，歌宛转，旧日秦淮水清浅，此曲之兴自早晚。
青溪桥边日欲斜，白土冈下驱虞车，越州女子颜如花。
中官采取来天家，可怜马上弹琵琶。三月桃花四月叶，巳报北兵屯六合。
两宫塞上行，日逐江东猎。桃叶复桃根，残英委白门。
相逢冶城下，犹有六朝魂。",思,悲
992,《台城》,829,张翥,元,元,,七言律诗,,张翥曾旅居金陵，历元之盛衰，故其诗多忧时伤乱之作。,以景结情，通过带有象征意味的景物渲染，传递出凄寒入骨的愁绝之情。,,,台城,,"运尽黄旗晋祚开，天星俄复坼三台。
方惊掘地双鹅起，已见浮江五马来。
草暗离宫碑仆土，雨残战地骨生苔。
当时一掬新亭泪，犹带寒潮日暮回。",乐,思
1645,《台城》,244,吴伟业,明,明末;清初,,七言律诗,,,,,,台城,,形胜当年百战收，子孙容易失神州。金川事去家还在，《玉树》歌残恨未休。徐邓功勋谁甲第，方黄骸骨总荒丘。可怜一片秦淮月，曾照降幡出石头。,悲,思
3422,《台城》,719,刘禹锡,唐,唐,,七言律绝,宝历二年（827年）,,《台城》构思着眼于古都皇权的象征，旧时宫苑所在，诗人以唐代已“万户千门成野草”之表象，诘问与追责当年陈后主作《玉树后庭花》醉生梦死、荒淫误国之史实，见微知著，洞若观火。,《金陵五题》、《西塞山怀古》、《金陵怀古》,,台城,刘禹锡在和州刺史任上,台城六代竞豪华，结绮临春事最奢。万户千门成野草，只缘一曲后庭花。,乐,喜
3472,《台城》,732,罗隐,唐,唐,,七言律诗,,,,,,台城,,晚云阴映下空城，六代累累夕照明。玉井已干龙不起，金瓯虽破虎曾争。亦知霸世才难得，却是蒙尘事最平。深谷作陵山作海，茂弘流辈莫伤情。,悲,思
3800,《台城》,781,韦庄,唐,唐,,七言律绝,,,凭吊六朝古迹、怀古。,,,台城,,江雨霏霏江草齐，六朝如梦鸟空啼。无情最是台城柳，依旧烟笼十里堤。,悲,思
3971,《台城》,824,张乔,唐,唐,,七言律绝,,自吴至陈六个短促的王朝，一个-一个衰败倾覆，那--个个哀怨相续的史实，那一道道无声的断壁颓垣，使多少骚人墨客为之感叹，反复吟咏。他们画金陵老木寒云，写往事-一片伤心。以“台城”为题者，前见刘禹锡，后有韦庄，“台城”一咏，各领风骚。张乔此首，同咏台城，“名”虽不及刘、韦，然亦写得颇有韵味，意蕴深长。,此诗描绘了晚唐时台城的荒凉情景。殿基长花树，雉堞绕渔樵，颇能发人想象，令人深思。,,,,,"宫殿余基长草花，景阳官树噪村鸦。
云屯雉堞依然在，空绕渔樵四五家。",乐,思
478,《玉树后庭花》,5,陈叔宝,南朝,陈,,乐府诗,,《后庭花》又叫《玉树后庭花》，以花为曲名，本来是乐府民歌中一种情歌的曲子。南北朝陈朝最后一个皇帝陈后主陈叔宝填上了新词。,《玉树后庭花》为宫体诗，被称为亡国之音。,《临春乐》,张贵妃、孔贵嫔,建康,,"丽宇芳林对高阁，新妆艳质本倾城。
映户凝娇乍不进，出帷含态笑相迎。
妖姬脸似花含露，玉树流光照后庭。
花开花落不长久，落红满地归寂中。",悲,忧
737,《玉树后庭花》,817,张祜,唐,唐,,乐府诗,,,,《临春乐》,,,,轻车何草草，独唱后庭花。玉座谁为主，徒悲张丽华。,思,悲
3978,《玉树后庭花（宝床香重春眠觉）》,0,张先,宋,宋,,词,,,此词为一首咏史吊古之作。词人登临昔日繁华绮丽，今日荒芜残败的台城，咏怀六朝末代帝王陈后主荒淫亡国的历史悲剧，感喟今昔，抒吊古之情。,《安陆词》,,,,"宝床香重春眠觉，魫窗难晓。新声丽色千人，歌后庭清妙。
青骢一骑来飞鸟，靓妆难好。至今落日寒蟾，照台城秋草。",思,喜
2009,《秦淮竹枝词》,377,纪映淮,清,明末;清初;清中,,七言律绝,,,,,,,,栖鸦流水点秋光，爱此萧疏树几行。不与行人绾离别，赋成谢女雪飞香。,思,悲
2528,《秦淮竹枝词》,519,周在浚,清,清,,七言律绝,,,,,,,,"布幔朱阑饰彩舟，少年箕踞放中流。三弦拨动《凉州》调，故老听来尽白头。
端阳节近说青溪，芳草门前踏作泥。到得秋来人寂寞，月明衰柳夜乌啼。
北人才得解征鞍，也学吴侬事事酸。金碗银盘都不用，素磁月下试龙团。",思,乐
3326,《踏莎行（铁锁横江）》,0,李汝章,清,清,,词,,,对于陈后主尤其是张丽华寄予了相当程度的同情。,,张丽华、陈叔宝,青溪、胭脂井,陈后主与妃投井,铁锁横江，琼枝歌阙，繁华王气同消歇。无愁帝子不归来，宫花落尽胭脂色。争似芳魂，还依故国，灵旗潜下青溪侧。风声吹树总为云，婵娟冷挂南朝月。,忧,思
3379,《踏莎行（蜡炬高高）》,0,刘敞,宋,北宋,,词,,,,,,,,蜡炬高高，龙烟细细。玉楼十二门初闭。疏帘不卷水晶寒，小屏半掩琉璃翠。桃叶新声，榴花美味。南山宾客东山妓。利名不肯放人闲，忙中偷取工夫醉。,思,乐
705,《金陵图》,781,韦庄,唐,唐,,七言律绝,,,,,,,,谁谓伤心画不成，画人心逐世人情。君看六幅南朝事，老木寒云满故城。,思,悲
793,《子夜歌》,710,李煜,南唐,南唐,,乐府诗,,,这首词的上片写作者感怀亡国的愁恨和梦回故国的痛苦。词的下片续写作者往日成空、人生如梦的感伤和悲哀。全词以“梦”为中心，集中写“空”，笔意直白，用心挚真。全词八句，句句如白话入诗，以歌代哭，不事雕琢，用情挚切。全词有感慨，有追忆，有无奈，有悲苦，这一切因其情真意深而感人不浅，同时也因其自然流露而愈显其曲致婉转。,《欢闻歌》,,,,"人生愁恨何能免，销魂独我情何限！故国梦重归，觉来双泪垂。
高楼谁与上？长记秋晴望。往事已成空，还如一梦中。",悲,思
186,《襄阳乐》,31,刘诞,南朝,刘宋,,五言古体诗,499年,《乐府诗集·襄阳乐》引《古今乐录》：“诞始为襄阳郡，元嘉二十六年（449年），仍为雍州刺史（南朝侨置雍州于襄阳），夜闻诸女歌谣，因而作之”。,表现了女子的忧叹。,《古今乐录》,,,,"朝发襄阳城，暮至大堤宿。大堤诸女儿，花艳惊郎目。
上水郎担篙，下水摇双橹。四角龙子幡，环环当江柱。
江陵三千三，西塞陌中央。但问想随否，何计道里长。
人言襄阳乐，乐作非侬处。乘星冒风流，还侬扬州去。
烂漫女萝草，结曲绕长松。三春虽同色，岁寒非处侬。
黄鹄参天飞，中道郁徘徊。腹中车轮转，欢今定怜谁。
扬州蒲锻环，百钱两三丛。不能买将还，空手揽抱侬。
女萝自微薄，寄托长松表。何惜负霜死，贵得相缠绕。
恶见多情欢，罢侬不相语。莫作乌集林，忽如提侬去。",喜,悲
269,《估客乐》,99,萧赜,南朝,刘宋;齐,,乐府诗,,帝布衣时，尝游樊、邓。登祚以后，追忆往事而作歌。,,,,,,"昔经樊邓役，阻潮梅根渚。
感忆追往事，意满辞不叙。",思,忧
3345,《虞美人（春花秋月何时了）》,710,李煜,南唐,南唐,,词,北宋太宗太平兴国三年（978）,这首《虞美人》是李煜的绝命之词，是时李煜幽囚汴京已近三年。,此词为作者绝笔，是一曲生命的哀歌，作者通过对自然永恒与人生无常的尖锐矛盾的对比，抒发了亡国后顿感生命落空的悲哀。,《南唐二主词》,,,,春花秋月何时，往事知多少？小楼昨夜又东风，故国不堪回首月明中！雕栏玉砌应犹在，只是朱颜改。问君能有几多愁？恰似一江春水向东流。,思,悲
4052,《虞美人（牙签插架和云散）》,0,严骏生,清,清,,词,,,,,,,,"牙签插架和云散，数卷惊重见。开编见我问书知，犹忆秋窗分坐校仇时。
先生手泽增身价，墨迹如新写。他年归送小仓山，化鹤人归可念浦珠还。",思,乐
863,《浪淘沙（帘外五更风）》,704,李清照,宋,北宋;南宋,,词,建炎四年（1130）,赵明诚在金陵病逝，李清照本人“又大病，仅存喘息”。她的《浪淘沙》词倾吐出悼念亡夫之悲情。,作品上片以昔日夫妻团聚、琴瑟和谐的幸福生活，衬托今日新寡之凄寂悲楚。下片触景生情，烟雨迷蒙的春景恰正折射出此刻词人内心的惆怅与忧愁。最后只得寄情于物，希望天上飞过的征鸿带着自己的伤心热泪，送给冥冥之中的夫君。,,赵明诚,金陵,,"帘外五更风，吹梦无踪。画楼重上与谁同？记得玉钗斜拨火，宝篆成空。
回首紫金峰，雨润烟浓，一江春浪醉醒中。留得罗襟前日泪，弹与征鸿。",思,乐
3026,《浪淘沙（疏雨洗天晴）》,662,邓剡,宋,南宋,,词,1279年,元十六年（1279年），邓剡在厓山被俘虏，并与文天祥一同被押解北上，在途经建康时，邓剡作了此词。,这首词寓含有怀古感今的浓浓深情，语言极为明快，堪称邓剡现存的词中的一篇佳作。词的上片，“疏雨洗天清，枕簟凉生。井桐一叶做秋声”。暑退寒来之节气替代，说出盛极而衰的人生哲理。宋室覆亡，故国不在，如瑟瑟寒秋，令人心灰神懒。“疏雨洗天清”，然而天清世不清，能奈其何。室内枕席生凉，是实写秋天到来天气生凉，气候更替，室外井桐落叶，既是报秋，又勾起词人对自己身世的感叹。给全词的气氛作了烘托，深含怀古的幽幽情感。“谁念客身轻似叶，千里飘零？”叶随风飘，说明个人命运的不可把握，也表明作者对邦国沦亡悲哀之情。“千里”是概括在广东被俘到建康的旅程。词的下片，“梦断古台城。月淡潮平。”无限哀思难以排解。邓剡把它带到梦乡，醒来却发觉古台城上梦凄凉。词人的心境本来就很哀伤，但醒来见月色暗淡，海潮泛起，禁不住自己也心潮澎湃，心里更加凄怆。梦醒之后，只能去“便须携酒访新亭”。王导在当年的新亭会上，还主张“戮力王室，克服神州”，但词人和文天祥都做了俘虏，宋王朝已彻底亡矣。“不见当时王谢宅，烟草青青。”邓剡对世事无常、朝代兴亡的感慨，因为真实的遭遇而显得格外深沉，结句移情入景，寓激于婉，凄苦的亡国之音，袅袅不绝。,,文天祥、王导,新亭,,疏雨洗天清，枕簟凉生。井桐一叶做秋声。谁念客身轻似叶，千里飘零？梦断古台城、，月淡潮平。便须携酒访新亭。不见当时王谢宅，烟草青青。,思,悲
3340,《浪淘沙》,710,李煜,南唐,南唐,,词,此词是作者去世前不久所作,李煜被囚汴京。,抒发了由天子降为臣虏后难以排遣的失落感，以及对南唐故国故都的深切眷念。全词语言清澈自然，明白如话，情真意切，哀婉动人，深刻地表现了词人的亡国之痛和囚徒之悲。,《南唐二主词》,,汴京,李煜被囚汴京,帘外雨潺潺，春意阑珊，罗衾不耐五更寒。梦里不知身是客，一晌贪欢。独自莫凭栏，无限江山，别时容易见时难。流水落花春去也，天上人间。,悲,思
407,《从军行》,94,萧纲,南朝,梁,,乐府诗,,,《从军行》是南北朝萧纲创作的一组乐府诗。,,,,,"贰师惜善马，楼兰贪汉财。前年出右地，今岁讨轮台。鱼云望旗聚，龙沙随阵开。冰城朝浴铁，地道夜衔枚。将军号令密，天子玺书催。何时反旧里，遥见下机来。
云中亭障羽檄惊。甘泉烽火通夜明。贰师将军新筑营。嫖姚校尉初出征。复有山西将。绝世爱雄名。三门应遁甲。五垒学神兵。白云随阵色。苍山答鼓声。逦迤观鹅翼。参差睹雁行。先平小月阵。去灭大宛城。善马还长乐。黄金付水衡。小妇赵人能鼓瑟。侍婢初笄解郑声。庭前柳絮飞已合。必应红妆起见迎。",怒,忧
3879,《河中之水歌》,97,萧衍,南朝,梁,,七言古体诗,,,《河中之水歌》是首叙事古诗，塑造了莫愁美丽率真的形象。全诗十四句中，连用十二句铺叙其生活环境之无比优裕，简直让人艳羡不已，感叹人生富贵，至此无以复加。然而就在读者可能产生错觉误解之时，诗笔突然急转，一句“恨不嫁与东家王”点明题旨。诗的民歌风味极浓。首句以河水东流起兴引出洛阳女儿，饶有趣味。述莫愁经历，排比铺叙，同《焦仲卿妻》兰芝“十三能织素”一段颇有渊源。语言通俗明快、流走自然，更见民歌特色。,《乐府诗集·杂歌谣辞》、《孔雀东南飞》、《相逢行》,莫愁,,莫愁出嫁,"河中之水向东流，洛阳女儿名莫愁。
莫愁十三能织绮，十四采桑南陌头。
十五嫁于卢家妇，十六生儿字阿侯。
卢家兰室桂为梁，中有郁金苏合香。
头上金钗十二行，足下丝履五文章。
珊瑚挂镜烂生光，平头奴子擎履箱。
人生富贵何所望，恨不嫁与东家王。",悲,思
