作品id,作品名,人物id,名字,朝代,时期,国家,文体,写作时间,创作背景,内容简介,相关作品,相关人物,相关地点,相关事件,诗歌全文,sentiment1,sentiment2
984,《水调歌头（他山一卷石）》,800,许有壬,元,元,,词,,许有壬于英宗至治二年（1323）出任江南行台监察御史，府治即在金陵。他在金陵遍访古迹，创作了不少咏史词作。,着眼于陈代遗迹“胭脂井”，揭示统治者不恤民命、穷奢极欲而导致亡国的历史教训，从而得出了“甚矣色成荒”的兴亡之理。,,,南京胭脂井,,他山一卷石，何意效时妆。天生偶然斑驳，兰麝不能香。＊作陈家宫井，浇出后庭玉树，直使国俱亡。故邑久眢废，陈迹草茫茫。叹人间，才璇室，又阿房。丽华＊发如鉴，曾此笑相将。一旦江山瓶坠，犹欲夫妻同穴，甚矣色成荒。五色补天缺，万世仰娲皇。,乐,悲
4100,《水调歌头（霜降碧天静）》,809,叶梦得,宋,南宋,,词,,叶梦得是朝廷重臣，乂是北宋南渡词人中的前辈，此同约作于绍兴八年（1138年），作者知建康府时期。当时北方大片国土为金兵所据，只拥有半壁河山，建康已成为南宋王朝扼江守险、支援北伐军需的重镇。,"上片起首即写寒霜陡降。“秋事”（指秋收、制寒衣等）急迫，表达了冬之将至，作者对前方将士的深切关注。“寒声”不是一响而过，而是从“隐地初听”到“中夜人梧桐”让他难以人眠，熔情于景，忧心感人起瞰”句写为排遣国土沦丧、山河破碎的沉痛，借酒消愁，与客同醉至叠鼓”句，词意顿时扬起，演武场上紧张而热烈。
下片写西园习射。座中客正当盛年，武场较胜，欢谈笑语，争相夸美，不禁引起迟暮之年的词人对往事的回忆，使他以自诘的语气喟叹英雄已老，羡慕“当筵虎士”英武骁勇报国有期结尾两句，以慷慨悲凉的笔触，感愧老病，不能报效祖国于疆场.只好冋首长望北方的云中郡，那魏尚和李广奋勇抗击过匈奴的土地。
此词为叶梦得的代表作之一，全词笔力雄健，词情沉郁而又苍健，显示了作者高超的艺术功力和“烈士暮年，壮心不已”的爱国情怀。",,,,,"霜降碧天静，秋事促西风，寒声隐地初听，中夜入梧桐。起瞰高城回望，寥落关河千里，一醉与君同。叠鼓闹清晓，飞骑引雕弓。
岁将晚，客争笑，问衰翁：平生豪气安在？走马为谁雄？何似当筵虎士，挥手弦声响处，双雁落遥空。老矣真堪愧，回首望云中！",悲,思
3731,《泊船瓜洲》,768,王安石,宋,北宋,,七言律绝,相传为作者辞官第二年所作,诗人乘船路过瓜洲，怀念金陵故居所作。,流露着对故乡的怀念之情，在字里行间也寓着他重返政治舞台、推行新政的强烈欲望。,,,京口、瓜洲、钟山,,京口瓜洲一水间，钟山只隔数重山。春风又绿江南岸，明月何时照我还？,思,乐
3395,《光宅寺》,34,刘令娴,南朝,梁,,五言古体诗,,南朝佛寺诗歌艺术价值都不甚高，坦诚地说大多都是为了应付皇上而不得不无感而感，对佛寺大肆赞美奉承其实就是间接地拍皇上的马屁，谈不上什么真情实感的自然流露，最多只是才能的炫耀罢了。而刘令娴则不同，她除了更深一层地把佛寺当作人物活动的背景以外，还大胆表现出现实人情，既无需任何矫饰更无需隐瞒。,此诗似乎无一字着意于佛寺，却无一字不欲写佛寺。喧闹的“长廊”、“广殿”，只是表面张扬着的虚无，而真实的也许就在那“曲房”里的“无人声”时。动与静的对比，喧嚣与静寂的对比，虚无与真实的对比，既生动地反映了现实，又充满深刻的哲理。诗中所写场景的确很可以给人无限丰富的隐晦的想象空间。,《梁诗》,梁武帝,光宅寺,光宅寺始建于南朝梁天监七年（508年），原为梁武帝萧衍的故宅。,长廊欣目送，广殿悦逢迎。何当曲房里，幽隐无人声？,思,乐
779,《浣溪沙（手卷真珠上玉钩）》,703,李璟,南唐,南唐,,词,,可能是在南唐受后周严重威胁的情况下，李璟借小词寄托其彷徨无措的心情。,这是一首伤春词、春恨词。此词借抒写男女之间的怅恨来表达作者的愁恨与感慨。上片写重楼春恨，落花无主；下片进一层写愁肠百结，固不可解。,《摊破浣溪沙·手卷真珠上玉钩》,,,,"手卷真珠上玉钩，依前春恨锁重楼。风里落花谁是主，思悠悠。
青鸟不传云外信，丁香空结雨中愁。回首渌波三峡暮，接天流。",悲,思
780,《浣溪沙（菡萏香销翠叶残）》,703,李璟,南唐,南唐,,词,,,上片重在写景，下片重在写人抒情。写景从西风残荷的画面写起，以韶光憔悴在加重，更见秋景不堪；写人从思妇怀人写起，梦回而感鸡塞征夫之遥远，倚栏而更见凄凉。,《摊破浣溪沙·菡萏香销翠叶残》,,,,"菡萏香销翠叶残，西风愁起绿波间。还与韶光共憔悴，不堪看。
细雨梦回鸡塞远，小楼吹彻玉笙寒。多少泪珠何限恨，倚阑干。",悲,思
786,《浣溪沙（红日已高三丈透）》,710,李煜,南唐,南唐,,词,,是李煜前期的作品，真实地再现了李煜前期的奢华绮丽的享乐生活。李煜写此词时，是自鸣得意的。词中所写的时间，是夜以继日地酣歌曼舞的第二天。主人公是后主李煜和宫中所有的人们。,是南唐后主李煜在江南盛时对其宫中歌舞升平景况的描写。反映了李煜早期的宫廷生活。此词描写帝王享乐的词，艺术上的精美与内容上的腐朽形成了鲜明的对比，同时也同作者后期的词作形成了巨大的反差。由此可见，如果不是对这种耽于奢华生活乐而不疲，恐怕李煜也不一定会成为一个亡国之君，阶下之囚。,,,,,"红日已高三丈透，金炉次第添香兽。红锦地衣随步皱。
佳人舞点金钗溜，酒恶时拈花蕊嗅。别殿遥闻箫鼓奏。",乐,思
1708,《浣溪沙（曲曲蚕池数里香）》,603,曹寅,清,清初;清中,,词,,,描写了织户之苦。,,,,,"曲曲蚕池数里香，玉梭纤手度流黄。天孙无暇管凄凉。
一自昭阳新纳锦，边衣常碎九秋霜。夕阳冷落出高墙。",悲,思
2165,《浣溪沙》,424,屈大均,清,清,,词,,,家国情思，遗民之痛。,,,,,一片花含一片愁，愁随江水不东流。飞飞长榜景阳楼。六代只馀芳草在，三园空有乳莺留。白门容易白人头。,悲,思
3157,《浣溪沙（潇洒梧桐几度秋）》,0,韩准,宋,宋,,词,,,,,,,,"潇洒梧桐几度秋。凤凰飞去旧山幽。风景不殊人物换，恨悠悠。
衰草远从烟际合，夕阳空趁水西流。恰好凭楼便回首，怕生愁。",悲,思
3319,《浣溪沙》,703,李璟,南唐,南唐,,词,,,,,,江陵、彭城,,手卷真珠上玉钩，依前春恨锁重楼。风里落花谁是主？思悠悠。青鸟不传云外信，丁香空结雨中愁。回首绿波三楚暮，接天流。,悲,思
3603,《浣溪沙（三首）》,0,沈祖棻,现当代,现当代,,词,1942年-1946年,1932年春，就读于中央大学文学院中文系的沈祖棻，在文学院长兼中文系主任汪东先生讲授的词选课上，写出她早年成名作《浣溪沙》：“芳草年年记胜游，江山依旧豁吟眸。鼓鼙声里思悠悠。三月莺花谁作赋？一天风絮独登楼。有斜阳处有春愁！”汪东先生读到此词，“对1931年九一八事变后的民族危机，在一个少女笔下有如此微婉深刻的反映，感到惊奇，就约她谈话，加以勉励，从此她对于学词的兴趣更大，也更有信心了”。这是程千帆先生在《沈祖棻小传》中的记叙，程文还忆及1937年抗战爆发后，民族的苦难，个人的流离辛苦，使女词人写出了一系列内涵更深刻的组词，抒发家国兴亡之感。,《浣溪沙》词三首写于1942年至1946年在成都金陵大学和华西大学执教时。“抗战后期，国民党反动派的丑恶面目逐渐暴露，纸醉金迷和啼饥号寒两种截然不同的生活，使得女诗人万分愤慨，她拿起笔来战斗了。在这一时期的词中，她忠实地写出了当时政治社会生活的某些侧面。这四年是她创作最丰富的时期”（引自程千帆《沈祖棻小传》）上世纪六七十年代，台湾大学教授、著名作家和书法家台静农先生曾亲笔抄录女词人的这篇《浣溪沙》词，并在抄件旁附注：“此沈祖棻抗战时所作，李易安身值南渡却未见有此感怀也”可见这组《浣溪纱》流传与影响之广。,,,新亭、临安,,"浣溪沙（三首）
客有以渝州近事见告者，感成小词。
岁岁新烽续旧烟，人间几见海成田，新亭风景异当年！
如此山河输半壁，依然歌舞当长安，危阑北望泪如川。

莫向西川问杜鹃，繁华争说小长安，涨波脂水自年年。
筝笛高楼春酒暖，兵戈远塞铁衣寒，尊前空唱念家山。

辛苦征人百战还，渝州非复旧临安，繁华疑是梦中看。
彻夜笙歌新贵宅，连江灯火估人船，可怜万灶渐无烟。",悲,思
960,《沁园春（我望山形）》,637,白朴,元,元,,词,,这是白朴定居金陵之后的一首怀古词。一般说来，任何怀古之作，都绝不仅仅单纯地去为怀古而怀古，怀古与伤今差不多是影与形-一样，总是紧密相联系的。从某种意义来看，克罗奇的“一切历史都是当代史”，不是完全没有道理的。另一位可与克罗奇平分秋色的分析、批判的历史哲学家科林伍德说得更为有趣：“每个历史学家都以自己为中心，根据他自己的角度来观察历史，因此他看到别人所看不到的某些问题，而且每个历史学家都根据他自己特有的观点，也就是从他特有的-个方面来观察每个问题。”（《现代西方历史哲学译文集》）我们虽然不能完全同意这两位西方史学家和哲学家的观点，却不能否定他们这些观点的启发性。白朴不是历史学家，但他写历史剧，又写怀古词。他的《梧桐雨》杂剧基本上取材于新旧唐书和野史杂传，但主观抒情色彩极为浓厚。可以说，白朴对历史有自己的独特理解。明乎此，再来看这首怀古词，我们就比较容易得出其要领。,"词以雄浑起，却以寂寥而终。只从怀古幽情所注，抒发兴亡感慨角度视之，白词既不能出于李白怀古诗之右，也不能与苏、辛怀古词比肩。但，白词自有其特色在。首先值得我们注意的是，白朴对现实的执着关切，不思还念，欲罢不能。作者历数往事陈迹，虚疏而过，且遣词立意未曾超越前人，中兴东晋，下逮南唐，中以后主词句略作点缀，尚未见高明。而“今何日”，“今日还乡”，以及“问乌衣旧宅”，听渔舟鸣榔（渔民捕鱼时，敲击船板，惊鱼人网），则欲哭欲泣，至哀至痛。这一点，给我们的印象格外深。其次，是词人的孤独感、幻灭感格外强烈，历史与现实的对比也显得非常鲜明。我们知道，白朴一生处易代之时，“生长兵间，流落窜逸”（陈霆《渚山堂词话》），成年之后则“志不得伸”（胡侍《真珠船》，内心的矛盾和痛苦可以想见。本来白朴的父亲白华对儿子是怀着热望的，冀求白朴“鹏抟万里程”（白华《示恒》）。白朴自己也曾有凌云壮志，只是遭时不遂，屈己降志，万般无奈。白朴36岁时，开府宰相史天泽曾欲荐举白朴出仕，白朴断然拒绝了。为什么呢?看看其父白华连事三朝，遭到了士大夫“国危不能以义自处”的贬斥，落得个“名声扫地”（《金史·白华传》）的下场，可知白朴的“拒荐”，决不是轻易之举。白朴一生，活得何等艰难呵！故此词中的“吊古愁浓”句，当别加注脚，白朴分明是哀叹自己遭时不逢、困顿颠踬的人生道路。对“漫流尽英雄泪万行”，也应从这样的意义上去理解。他的“志在长林丰草间”，“得延残喘”（《沁园春·监察师巨源将辟予为政，因读嵇康与山涛书，有契于予心者，就谱此词以谢》），原是出于难以言传的隐衷。此词结尾处写夕阳落尽，渔歌隐隐，鸣榔阵阵，都突出了作者内心旷古未有的孤独和寂寥。
最后，才是这首词写法上的平易、简淡，寄深情于浑厚天然之中。词作不堆砌，去靡缛，伤时寓慨，雄沉顿挫，王博文所评“词语道严，情寄高远”（《天籁集序》）；朱彝尊所说“源出苏、辛，而绝无叫嚣之气”（《天籁集跋》），此词实当之无愧。",《天籁集》、《梧桐雨》、《墙头马上》,,金陵,,我望山形，虎踞龙盘，壮哉建康。忆黄旗紫盖，中兴东晋，雕栏玉砌，下逮南唐。步步金莲，朝朝琼树，宫殿吴时花草香。今何日，尚寺留萧姓，人做梅妆。长江不管兴亡，谩流尽英雄泪万行。问乌衣旧宅，谁家作主，白头老子，今日还乡。吊古愁浓，题诗人去，寂寞高楼无凤凰。斜阳外，正渔舟唱晚，一片鸣榔。,乐,思
2996,《沁园春（十万琼枝）》,308,陈维崧,清,清,,词,1671年,康熙十年（1671）徐渭文去南京，陈维崧有《赠徐渭文序》，嘱其应一访“畸人而隐于绘事”者如龚半千等。他此游原有一吊故国之意。徐氏归，成《钟山梅花图》，旋即掀起一场题咏殆遍的凭吊活动，一批怀抱易代之悲的词人纷纷为此画题词。这实际上是一次借图哭陵的集会，遥祭明孝陵，也即吊故国。此词即是其一。,这首词把画中的梅花写得真幻难分，亦真亦幻，使往昔与如今、想象与现实两相错杂交织成篇，从而抒发世事沧桑、恍如一梦之感。上片从不同侧面刻画梅花，突出其姿态之美与风神之幽，进而联想明末金陵繁华之景；下片化用刘禹锡、杜牧诗意，又选用啼乌、石马、流水，落花等意象，抒发易代之悲，结拍设想友人天水为伴，江湖余生，表达自己不仕新朝的态度。词中虚实结合，善用对比，情词兼胜，骨韵都高。,《赠徐渭文序》、《钟山梅花图》、《山园小梅》、《石头城》、《泊秦淮》、《相见欢·林花谢了春红》,徐渭文、云臣、南耕、京少、刘禹锡、杜牧、李煜,南京,,题徐渭文《钟山梅花图》，同云臣、南耕、京少赋。十万琼枝，矫若银虬，翩如玉鲸。正困不胜烟，香浮南内；娇偏怯雨，影落西清。夹岸亭台，接天歌管，十四楼中乐太平。谁争赏？有珠珰贵戚，玉佩公卿。如今潮打孤城，只商女船头月自明。叹一夜啼乌，落花有恨；五陵石马，流水无声。寻去疑无，看来似梦，一幅生绡泪写成。携此卷，伴水天闲话，江海余生。,思,乐
3295,《沁园春（漫浪江头）》,697,李曾伯,宋,南宋,,词,,,,,,,,漫浪江头，三听秋砧，一登故台。望烟芜莽苍，令人目断，风樯掀舞，何日眉开。把酒新亭，围棋别墅，老气当时何壮哉。江东事，百年无恙，全是时才。纷然竞付轻埃。还水绕赏心东向淮。叹阿奴侪悲，因人碌碌，乃翁材略，馀地恢恢。凤阙天高，鹭洲潮落，约取白鸥归去来。阑干外，英雄陈迹，一醁琼杯。,思,悲
3296,《沁园春（再和）》,697,李曾伯,宋,南宋,,词,,,,,,,,绮阁香销，玉砌梦残，凄凉旧台。对御沟红叶，一番木落，宫墙黄菊，几度花开。水溯岷源，山联吴会，目送征鸿安往哉。都休问，六朝人物，谁拙谁才。平生衮衮烟埃。记匹马当年荆蜀淮。叹凋零殆尽，词源已竭，消磨未去，酒量犹恢。八跪蟹肥，四腮鲈美，客有可人招不来。油幢暇，凭栏一笑，相与传杯。,思,乐
1573,《扁舟》,599,龚贤,明,明末;清初,,五言律诗,,,,,,,,扁舟当晓发，沙岸杳然空。人语蛮烟外，鸡鸣海色中。短衣曾去国，白首尚飘蓬。不读荆轲传，羞为一剑雄。,思,悲
3376,《一剪梅（百尺危楼）》,0,凌廷堪,清,清,,词,,,,,,,,百尺危楼俯瞰江。山既崆?。水又舂撞。閒吹玉笛不成腔。风颤银釭。月浸篷窗。愁见牙樯燕一双。诗笔休扛。酒盏难降。无端惊起隔花庬。船鼓逢逢。心事桩桩。,悲,思
4013,《长干里》,513,郑燮,清,清,,七言古体诗,,,此诗反映了当年长干里“缫丝织绣家家事”的情况，可知金陵丝织的历史悠久，工艺精美。,《修竹新篁图》、《清光留照图》、《兰竹芳馨图》、《甘谷菊泉图》、《丛兰荆棘图》,,,,"墙里开花墙外见，篱门半覆垂杨线,
门外春流一派清，青山立在门当面。
老子栽花百种多,清晨担卖下前坡,
三间古屋无儿女,换得鲜鱼供阿婆。
缫丝织绣家家事，金凤银龙供天子,
花样新添一线云,旧机不用西湖水。
机上男儿百巧民，单衫布褐不遮身,
中原百岁无争战，免荷干戈敢怨贫。",悲,思
1076,《游灵谷寺》,194,归有光,明,明中,,五言古体诗,1536年,归有光曾经六应乡试，多次流连在南京。,描写了灵谷寺的清新景色和幽寂氛围，表现出理性睿智的艺术感知。,,,灵谷寺,,"晨出东郭门，初日照我颜。
春风吹习习，好鸟声绵蛮。
岩阿见黄屋，登披寻神山。
半日犹山麓，十里长松间。
蜿蜒芳草路，寂寞古禅关。
画廊落丹雘，朱户蚀铜镮。
殿起无梁迥，塔留玩珠攀。
苍鼠戏树捷，野鹿看人閒。
山深静者爱，日晏未知还。",思,乐
2143,《游灵谷寺》,610,钱大昕,清,清,,五言律诗,,作者在南京生活期间写下。,赞美古城南京，吟咏南京风物。,,,,,五里松荫合，三义石径微。客情和水淡，诗思趁花飞。是处闻天籁，何心拾地肥。宝公应许我，趺坐暂忘机。,思,乐
4142,《游灵谷寺》,0,周达,明,明,,七言律诗,,,,,,灵谷寺,,出郊为访志公林，塔影还从静室临。象外涤襟泉有德，阶前鼓掌地成音。忽闻鸟韵惊迷性，漫倚松涛试定心。幽寂偏宜驺从去，独留明月伴讴吟。,思,乐
2020,《百字令》,382,蒋敦复,清,清中;清末,,词,,,,,,,,"一堆黄土，劝卿休白眼，我来浇酒。痛哭平生才子泪，此泪除卿安有。我亦当年，最伤心者，肯落千秋后。风流尽矣，青山今日回首。
多少典午衣冠，禅文九锡，人世何鸡狗。党籍遗风高士传，玉骨棱棱不朽。龙性难驯，鸿飞已冥，以酒全其寿。茫茫万古，醉魂知尚醒否？",悲,思
3817,《金陵驿》,783,文天祥,宋,南宋,,七言律诗,1279年3月,诗人兵败被俘，押解前往燕京。,诉说亡国之痛、殉国之志。,,文天祥,,,草合离宫转夕晖，孤云飘泊复何依？山河风景元无异，城郭人民半已非。满地芦花和我老，旧家燕子傍谁飞？从今别却江南路，化作啼鹃带血归。,思,悲
3597,《应王中丞思远咏月》,60,沈约,南朝,南朝,,五言古体诗,,,这是首描写才子佳人暨洞房的诗。诗人从“月光”的角度切入主题，以至深夜月光入洞房，照到“网轩”（类似夏日蚊帐）和花花绿绿的铺盖（“绿苔”）上；初婚者一夜未觉，任凭月光悠然而去。这首情诗的第二句，却完全是物理现象的真实写照：月光从门户而入，光亮如门一样大；月光从孔隙中来，光亮是圆的。诗作者如实地记下了小孔成像的物理实验的结果，但他未必做过这类实验。,,,西园,,"月华临静夜。
夜静灭氛埃。
方晖竟户入。
圆影隙中来。
高楼切思妇。
西园游上才。
网轩映珠缀。
应门别录苔。
洞房殊未晓。
清光信悠哉。",思,乐
3498,《西洲曲》,0,南朝乐府民歌,南朝,南朝,,乐府诗,,,全诗以第一人称，自述恋爱中的女子对心上人的苦恋。,《玉台新咏》,,,,"忆梅下西洲，折梅寄江北。
单衫杏子红，双鬓鸦雏色。
西洲在何处？两桨桥头渡。
日暮伯劳飞，风吹乌桕树。
树下即门前，门中露翠钿。
开门郎不至，出门采红莲。
采莲南塘秋，莲花过人头。
低头弄莲子，莲子清如水。
置莲怀袖中，莲心彻底红。
忆郎郎不至，仰首望飞鸿。
鸿飞满西洲，望郎上青楼。
楼高望不见，尽日栏杆头。
栏杆十二曲，垂手明如玉。
卷帘天自高，海水摇空绿。
海水梦悠悠，君愁我亦愁。
南风知我意，吹梦到西洲。",思,悲
3133,《孝陵图（有序）》,351,顾炎武,明,明,,五言古体诗,,,,,,,,"钟山白草枯，冬月蒸宿雾。
十里无立椔，冈阜但回互。
宝城独青青，日色上霜露。
殿门达明楼，周遭尚完固。
其外有穹碑，巍然当御路。
文自成祖为，千年系明祚。
侍卫八石人，祗肃候灵辂。
下列石兽六，森然象卤簿。
自马至狮子，两两相比附。
中间特崒嵂，有二擎天柱。
排立榛莽中，凡此皆尚具。
又有神烈山，世宗所封树。
卧碑自崇祯，禁约烦圣谕。
石大故不毁，文字犹可句。
至于土木工，俱已亡其素。
东陵在殿左，先时懿文祔。
云有?二层，去门可百步。
正殿门有五，天子升自阼。
门内庑三十，左右以次布。
门外设两厨，右殿上所驻。
祠署并宫监，羊房暨酒库。
以至各廨宇，并及诸宅务。
东西二红门，四十五巡铺。
一一费搜寻，涉目仍迷瞀。
山后更萧条，兵牧所屯聚。
洞然见铭石，崩出常王墓。
何代无厄菑，神圣莫能度。
幸兹寝园存，皇天永呵护。
奄人宿其中，无乃致亵污。
陵卫多官军，残毁法不捕。
伐木复撤亭，上触天地怒。
雷震樵夫死，梁压陵贼仆。
乃信高庙灵，却立生畏怖。
若夫本卫官，衣食久遗蠹。
及今尽流冗，存两千百户。
下国有虮臣，一年再奔赴。
低徊持寸管，能作西京赋。
尚虑耳目褊，流传有错误。
相逢虞子大，独记陵木数。
未得对东巡，空山论掌故。",乐,思
914,《青溪》,733,马光祖,宋,南宋,,七言律诗,,在建康任职期间，马光祖也创作了不少有关建康的文学作品。,诗人面对昔日繁华盛景的消亡虽有惆怅之意，但是却能在登阁览山、泛舟畅饮中放达情怀，尽享闲适之乐。,,,南京青溪,,"人道青溪有九曲，如今一曲仅能存。
江家宅畔成花圃，东府门前作菜园。
登阁自堪观叠嶂，汎舟犹可醉芳樽。
料应当日皆无恙，苕霅潇湘不足言",思,乐
170,《玩月城西门廨中》,2,鲍照,南朝,刘宋,,五言古体诗,,宋孝武帝孝建年间（454～456年），鲍照在秣陵县任县令。秋日作者于城西门官署中赏月，美丽的月色令作者联想到自己飘泊不定的仕官生活，于是对这种生活产生了厌倦情绪。作者为抒发情感于是创作了这首诗。,,,,,,始出西南楼，纤纤如玉钩。末映东北墀，娟娟似蛾眉。蛾眉蔽珠栊，玉钩隔琐窗。三五二八时，千里与君同。夜移衡汉落，徘徊帷户中。归华先委露，别叶早辞风。客游厌苦辛，仕子倦飘尘。休澣自公日，宴慰及私辰。蜀琴抽白雪，郢曲发阳春。肴干酒未阕，金壶启夕沦。回轩驻轻盖，留酌待情人。,思,乐
270,《拟古诗》,100,萧长懋,南朝,刘宋;齐,,七言古体诗,,,,,,,,磊磊落落玉山崩。,喜,悲
2438,《自嘲》,608,袁枚,清,清,,五言律诗,,,,,,,,苦被诗书管，常惊日影过。印贪三面刻，墨惯两头磨。学老先扶杖，辞官早畏靴。宾朋名屡忘，偏记古人多。,思,忧
